{
  "$schema": "https://json-schema.org/draft/2020-12/schema",
  "$schemaVersion": "0.0.1",
  "$id": "https://raw.githubusercontent.com/smart-data-models/Candidates/master/standards/gaiax-ontology-v2111/models/LegalPerson/schema.json",
  "modelTags": "GaiaX,Ontology,Legal,Trust",
  "title": "Smart Data Models - Gaia-X Ontology - LegalPerson",
  "description": "https://w3id.org/gaia-x/2.1.11#class/LegalPerson. A legal person, who is uniquely identified by its registration number. Subclass of Participant per the Gaia-X ontology; inherited properties are documented on the Participant model and not repeated here.",
  "type": "object",
  "properties": {
    "id": {
      "type": "string",
      "format": "uri",
      "description": "Property. Unique identifier of the entity"
    },
    "type": {
      "type": "string",
      "enum": [
        "LegalPerson"
      ],
      "description": "Property. NGSI-LD Entity type. It must be equal to 'LegalPerson'"
    },
    "dateCreated": {
      "type": "string",
      "format": "date-time",
      "description": "Property. Model:'https://schema.org/DateTime'. Entity creation timestamp."
    },
    "dateModified": {
      "type": "string",
      "format": "date-time",
      "description": "Property. Model:'https://schema.org/DateTime'. Timestamp of the last modification."
    },
    "source": {
      "type": "string",
      "description": "Property. A sequence of characters giving the source of the entity data."
    },
    "dataProvider": {
      "type": "string",
      "description": "Property. A sequence of characters identifying the provider of the harmonised data entity."
    },
    "registrationNumber": {
      "type": "array",
      "items": {
        "type": "string",
        "format": "uri"
      },
      "description": "Relationship. Country's registration number, which identifies one specific entity. Valid formats are local, EUID, EORI, vatID, leiCode. Links to one or more RegistrationNumber entities."
    },
    "legalAddress": {
      "type": "string",
      "format": "uri",
      "description": "Relationship. The full legal address of the organization. Links to an Address entity."
    },
    "headquartersAddress": {
      "type": "string",
      "format": "uri",
      "description": "Relationship. Full physical location of the headquarters of the organization. Links to an Address entity."
    },
    "parentOrganizationOf": {
      "type": "array",
      "items": {
        "type": "string",
        "format": "uri"
      },
      "description": "Relationship. A list of resolvable links to Gaia-X Credentials of participants that this entity is a subOrganization of, if any. Links to one or more LegalPerson entities."
    },
    "subOrganisationOf": {
      "type": "array",
      "items": {
        "type": "string",
        "format": "uri"
      },
      "description": "Relationship. A list of resolvable links to Gaia-X Credentials of participants with a legal mandate on this entity, e.g. as a subsidiary. Links to one or more LegalPerson entities."
    }
  },
  "required": [
    "id",
    "type",
    "registrationNumber",
    "legalAddress",
    "headquartersAddress"
  ]
}
