{
  "id": "urn:ngsi-ld:LegalPerson:001",
  "type": "LegalPerson",
  "dateCreated": "2026-08-20T10:00:00Z",
  "dateModified": "2026-08-20T10:00:00Z",
  "source": "https://docs.gaia-x.eu/ontology/v2111/classes/LegalPerson/",
  "dataProvider": "Gaia-X AISBL",
  "registrationNumber": [
    "urn:ngsi-ld:RegistrationNumber:001"
  ],
  "legalAddress": "urn:ngsi-ld:Address:001",
  "headquartersAddress": "urn:ngsi-ld:Address:001",
  "parentOrganizationOf": [],
  "subOrganisationOf": []
}
